### ISSUE TITLE
communication is default at UDP port, not loop device. 

### ISSUE THREAD

**Issue by JD-ETH** [MIT-TESSE/goseek-challenge#1]
Discovered in this [issue](https://github.com/MIT-TESSE/tesse-gym/issues/3).
Calling `./goseek-v0.1.0.x86_64 --listen_port 9000 --send_port 9000 --set_resolution 320 240` results in transmitting UDP packets at very high pace and blocks the local network. 
```
18:56:50.019812 IP 192.168.1.215.37128 > 255.255.255.255.9004: UDP, length 565
18:56:50.020323 IP 192.168.1.215.37128 > 255.255.255.255.9004: UDP, length 559
18:56:50.022466 IP 192.168.1.215.55402 > 255.255.255.255.9010: UDP, length 579
```

Expected to use localhost.

**Comment by JD-ETH** [comment]
Solution is found here: https://github.com/MIT-TESSE/tesse-gym/issues/3
